23406956	Protective role of L-carnitine and vitamin E on the testis of atherosclerotic rats.	Atherosclerosis is a condition caused by lipid build-up and inflammation in the arteries, so hyperlipidemia is the major reason for atherosclerosis. Testis was found to be negatively affected by hyperlipidemia which leads to its impaired functions. Vitamin E and <sc>l</sc>-carnitine have well-known lipid-lowering and antioxidative activities. Triton WR 1339 is a non-ionic detergent, which induces severe hyperlipidemia by inhibition of lipoprotein lipase. The present study evaluates the protective role of vitamin E and <sc>l</sc>-carnitine on the testis in atherosclerosis and detects the most effective choice for protection against atherosclerosis; vitamin E, <sc>l</sc>-carnitine or a combination of both. A total of 80 albino male rats were divided into eight groups (10 rats for each group): control (G(1)), triton (G(2)), <sc>l</sc>-carnitine (G(3)), triton + <sc>l</sc>-carnitine (G(4)), vitamin E (G(5)), triton + vitamin E (G(6)), <sc>l</sc>-carnitine + vitamin E (G(7)) and triton + <sc>l</sc>-carnitine + vitamin E (G(8)). Data showed a significant increase in the levels of total cholesterol (TC), triglycerides (TGs), low-density lipoprotein cholesterol (LDL-C), 17 beta hydroxysteroid dehydrogenase (17 β HSD), testicular catalase and malondialdehyde (MDA) in G(2) when compared with G(1), whereas high-density lipoprotein cholesterol (HDL-C), serum testosterone, testicular 17 ketosteroid reductase (17 KSR), total thiol and glutathione-S-transferase (GST) data showed a significant decrease in G(2) when compared with G(1). Treatment with <sc>l</sc>-carnitine or/and vitamin E helps in improving the adverse effect of triton; also the histological changes confirm this finding. So the present study recommends all people to include <sc>l</sc>-carnitine and vitamin E in their diet to be protected against atherosclerosis.
23267767	Development of hypoxia-inducible factor (HIF)-1α inhibitors: effect of ortho-carborane substituents on HIF transcriptional activity under hypoxia.	A series of substituted ortho-carboranylphenoxyacetanilides were synthesized and evaluated for their ability to inhibit hypoxia-induced HIF-1 transcriptional activity using a cell-based reporter assay in HeLa cells expressing the HRE-dependent firefly luciferase reporter construct (HRE-Luc) and constitutively expressing CMV-driven Renilla luciferase reporter, and their ability to inhibit cell growth (GI(50)) using the MTT assay. Among the compounds synthesized, 1g and 1l showed significant inhibition of hypoxia-induced HIF-1 transcriptional activity (IC(50): 1.9 ± 0.4 and 1.4 ± 0.2 μM, respectively). Both compounds suppressed HIF-1α accumulation in a concentration-dependent manner. The porcine heart malate dehydrogenase (MDH) refolding assay revealed that compound 1l inhibited human Hsp60 chaperone activity (IC(50): 6.80 ± 0.25 μM) and this inhibition activity was higher than that of ETB (IC(50): 10.9 ± 0.63 μM).
10637238	Comparison of chemotherapy with chemohormonal therapy as first-line therapy for metastatic, hormone-sensitive breast cancer: An Eastern Cooperative Oncology Group study.	PURPOSE: Although hormonal therapy represents standard therapy for metastatic hormone-sensitive disease, many patients receive initial chemotherapy because of the location, bulk, or aggressiveness of their disease. It is uncertain whether simultaneous hormonal therapy provides additional benefit compared with chemotherapy alone. Eastern Cooperative Oncology Group trial E3186 was initiated to explore this question. PATIENTS AND METHODS: Between January 1988 and December 1992, 231 patients with estrogen receptor (ER)-positive or ER-unknown metastatic breast cancer were randomized to receive either chemotherapy (cyclophosphamide, doxorubicin, and fluorouracil inverted question markCAF) or chemohormonal therapy (CAF plus tamoxifen and Halotestin inverted question markfluoxymesterone; Pharmacia-Upjohn, Kalamazoo, MI inverted question markCAFTH) as front-line therapy for metastatic breast cancer. Patients who experienced a complete response to induction therapy either received or did not receive maintenance cyclophosphamide, methotrexate, fluorouracil, prednisone, and TH as a secondary randomization. RESULTS: The response rates (complete response and partial response) of patients who received CAF and CAFTH were similar (69.2% v 68.9%, respectively; P =.99). Time to treatment failure (TTF) was slightly longer for patients who received chemohormonal therapy compared with chemotherapy alone patients (13.4 months v 10.3 months, respectively; P =.087), and TTF was significantly longer in ER-positive compared with ER-negative patients (17.4 months v 10.3 months, respectively; P =.048). However, ER status had no effect on overall survival (30.0 months for CAF v 29.3 months for CAFTH). CONCLUSION: In patients with potentially hormone-sensitive metastatic breast cancer, chemohormonal therapy prolongs TTF for ER-positive patients without improving overall survival.
12167474	Toxic, halogenated cysteine S-conjugates and targeting of mitochondrial enzymes of energy metabolism.	Several haloalkenes are metabolized in part to nephrotoxic cysteine S-conjugates; for example, trichloroethylene and tetrafluoroethylene are converted to S-(1,2-dichlorovinyl)-L-cysteine (DCVC) and S-(1,1,2,2-tetrafluoroethyl)-L-cysteine (TFEC), respectively. Although DCVC-induced toxicity has been investigated since the 1950s, the toxicity of TFEC and other haloalkene-derived cysteine S-conjugates has been studied more recently. Some segments of the US population are exposed to haloalkenes either through drinking water or in the workplace. Therefore, it is important to define the toxicological consequences of such exposures. Most halogenated cysteine S-conjugates are metabolized by cysteine S-conjugate beta-lyases to pyruvate, ammonia, and an alpha-chloroenethiolate (with DCVC) or an alpha-difluoroalkylthiolate (with TFEC) that may eliminate halide to give a thioacyl halide, which reacts with epsilon-amino groups of lysine residues in proteins. Nine mammalian pyridoxal 5'-phosphate (PLP)-containing enzymes catalyze cysteine S-conjugate beta-lyase reactions, including mitochondrial aspartate aminotransferase (mitAspAT), and mitochondrial branched-chain amino acid aminotransferase (BCAT(m)). Most of the cysteine S-conjugate beta-lyases are syncatalytically inactivated. TFEC-induced toxicity is associated with covalent modification of several mitochondrial enzymes of energy metabolism. Interestingly, the alpha-ketoglutarate- and branched-chain alpha-keto acid dehydrogenase complexes (KGDHC and BCDHC), but not the pyruvate dehydrogenase complex (PDHC), are susceptible to inactivation. mitAspAT and BCAT(m) may form metabolons with KGDHC and BCDHC, respectively, but no PLP enzyme is known to associate with PDHC. Consequently, we hypothesize that not only do these metabolons facilitate substrate channeling, but they also facilitate toxicant channeling, thereby promoting the inactivation of proximate mitochondrial enzymes and the induction of mitochondrial dysfunction.
16893531	The effects of norepinephrine transporter inactivation on locomotor activity in mice.	BACKGROUND: Acute administration of different classes of antidepressants can enhance or reduce spontaneous locomotor activity in a novel environment, but the effects of chronic antidepressant treatment on spontaneous locomotor activity in novel and familiar environments are less well characterized. Because norepinephrine is an important regulator of spontaneous locomotor activity, we speculated that norepinephrine transporter blockade contributes to the effects of some antidepressants on spontaneous locomotor activity. METHODS: Antidepressant drugs (reboxetine, desipramine, imipramine, venlafaxine, bupropion) were administered acutely (intraperitoneal) or chronically (via osmotic minipump) to control and norepinephrine transporter knockout mice, and spontaneous locomotor activity in novel or familiar environments was recorded. RESULTS: Acute treatment with most norepinephrine transporter-blocking antidepressants decreased spontaneous locomotor activity in a novel environment, whereas chronic treatment decreased spontaneous locomotor activity in both novel and familiar environments. The exception was bupropion, a dual norepinephrine transporter/dopamine transporter blocker, which tended to increase spontaneous locomotor activity. Coadministration of reboxetine and the dopamine transporter blocker GBR 12909 also increased spontaneous locomotor activity. Norepinephrine transporter knockout mice had low basal spontaneous locomotor activity, which was increased by bupropion, whereas reboxetine had no effect in norepinephrine transporter knockout mice. CONCLUSIONS: Acute or chronic inactivation of the norepinephrine transporter decreases spontaneous locomotor activity in novel and familiar environments unless coupled with dopamine transporter blockade.
16854582	Effect of keratinocyte growth factor on cell viability in primary cultured human prostate cancer stromal cells.	In normal prostate, keratinocyte growth factor (KGF), also known as fibroblast growth factor-7 (FGF-7) serves as a paracrine growth factor synthesized in stromal cells that acts on epithelial cells through its receptor, KGFR. KGF and KGFR were found in human cancer epithelial cells as well as stromal cells. Since KGF expressed in epithelial cells of benign prostatic hyperplasia (BPH) and in prostate cancer, it has been suggested that KGF might act as an autocrine factor in BPH and prostate cancer. To investigate the roles of KGF in cancerous stroma, primary cultured human prostate cancer stromal cells (PCSCs) were isolated and evaluated. These PCSCs possessed estrogen receptors and KGFR, but not androgen receptor as determined by RT-PCR and Western blot, respectively. KGF exhibited mitogenic and anti-apoptotic effects that correlated with induction of cyclin-D1, Bcl-2, Bcl-xL and phospho-Akt expression in PCSCs, where treatment with KGF antiserum abolished cell proliferation and anti-apoptotic protein expression. PCSCs exposed to KGF for various time periods resulted in phosphorylation of Akt and subsequent up-regulation of Bcl-2. KGF modulated dynamic protein expression indicated that KGF triggered cell cycle machinery and then activated anti-apoptotic actions in PCSCs. Cell proliferation analysis indicated that tamoxifen or ICI 182,780 reduced cell viability in a dose-dependent manner; however, KGF prevented this inhibition, which further demonstrated KGF triggered anti-apoptotic machinery through activating Bcl-2 and phospho-Akt expression. In summary, KGF has an autocrine effect and serves as a survival factor in primary cultured human prostate cancer stromal cells.
17643344	Combination chemotherapy with a substance P receptor antagonist (aprepitant) and melarsoprol in a mouse model of human African trypanosomiasis.	Drug therapy for late-stage (encephalitic) human African trypanosomiasis (HAT) is currently very unsatisfactory with the most commonly used drug, melarsoprol, having a 5% overall mortality. There is evidence in a mouse model of HAT that Substance P (SP) receptor antagonism reduces the neuroinflammatory reaction to CNS trypanosome infection. In this study we investigated the effects of combination chemotherapy with melarsoprol and a humanised SP receptor antagonist aprepitant (EMEND) in this mouse model. The melarsoprol/aprepitant drug combination did not produce any clinical signs of illness in mice with CNS trypanosome infection. This lack of any additional or unexpected CNS toxicity in the mouse model of CNS HAT provides valuable safety data for the future possible use of this drug combination in patients with late-stage HAT.
9990013	Cooperative binding of ATP and MgADP in the sulfonylurea receptor is modulated by glibenclamide.	The ATP-sensitive potassium (KATP) channels in pancreatic beta cells are critical in the regulation of glucose-induced insulin secretion. Although electrophysiological studies provide clues to the complex control of KATP channels by ATP, MgADP, and pharmacological agents, the molecular mechanism of KATP-channel regulation remains unclear. The KATP channel is a heterooligomeric complex of SUR1 subunits of the ATP-binding-cassette superfamily with two nucleotide-binding folds (NBF1 and NBF2) and the pore-forming Kir6.2 subunits. Here, we report that MgATP and MgADP, but not the Mg salt of gamma-thio-ATP, stabilize the binding of prebound 8-azido-[alpha-32P]ATP to SUR1. Mutation in the Walker A and B motifs of NBF2 of SUR1 abolished this stabilizing effect of MgADP. These results suggest that SUR1 binds 8-azido-ATP strongly at NBF1 and that MgADP, either by direct binding to NBF2 or by hydrolysis of bound MgATP at NBF2, stabilizes prebound 8-azido-ATP binding at NBF1. The sulfonylurea glibenclamide caused release of prebound 8-azido-[alpha-32P]ATP from SUR1 in the presence of MgADP or MgATP in a concentration-dependent manner. This direct biochemical evidence of cooperative interaction in nucleotide binding of the two NBFs of SUR1 suggests that glibenclamide both blocks this cooperative binding of ATP and MgADP and, in cooperation with the MgADP bound at NBF2, causes ATP to be released from NBF1.
23439561	NADPH Oxidase NOX5-S and Nuclear Factor κB1 Mediate Acid-Induced Microsomal Prostaglandin E Synthase-1 Expression in Barrett's Esophageal Adenocarcinoma Cells.	The mechanisms of progression from Barrett's esophagus (BE) to esophageal adenocarcinoma (EA) are not known. Cycloxygenase-2 (COX-2)-derived prostaglandin E2 (PGE2) has been shown to be important in esophageal tumorigenesis. We have shown that COX-2 mediates acid-induced PGE2 production. The prostaglandin E synthase (PGES) responsible for acid-induced PGE2 production in BE, however, is not known. We found that microsomal PGES1 (mPGES1), mPGES2, and cytosolic PGES (cPGES) were present in FLO EA cells. Pulsed acid treatment significantly increased mPGES1 mRNA and protein levels but had little or no effect on mPGES2 or cPGES mRNA. Knockdown of mPGES1 by mPGES1 small interfering RNA (siRNA) blocked acid-induced increase in PGE2 production and thymidine incorporation. Knockdown of NADPH oxidase, NOX5-S, a variant lacking calcium-binding domains, by NOX5 siRNA significantly inhibited acid-induced increase in mPGES1 expression, thymidine incorporation, and PGE2 production. Overexpression of NOX5-S significantly increased the luciferase activity in FLO cells transfected with a nuclear factor κB (NF-κB) in vivo activation reporter plasmid pNF-κB-Luc. Knockdown of NF-κB1 p50 by p50 siRNA significantly decreased acid-induced increase in mPGES1 expression, thymidine incorporation, and PGE2 production. Two novel NF-κB binding elements, GGAGTCTCCC and CGGGACACCC, were identified in the mPGES1 gene promoter. We conclude that mPGES1 mediates acid-induced increase in PGE2 production and cell proliferation. Acid-induced mPGES1 expression depends on activation of NOX5-S and NF-κB1 p50. Microsomal PGES1 may be a potential target to prevent or treat EA.
22968082	Influence of stimulant-induced hyperactivity on social approach in the BTBR mouse model of autism.	Translational research is needed to discover pharmacological targets and treatments for the diagnostic behavioral domains of autism spectrum disorders. Animal models with phenotypic relevance to diagnostic criteria offer clear experimental strategies to test the efficacy and safety of novel treatments. Antagonists of mGluR5 receptors are in clinical trials for Fragile X syndrome and under investigation for the treatment of autism spectrum disorders. However, in preclinical studies of mGluR5 compounds tested in our laboratory and others, increased locomotion following mGluR5 modulation has been observed. Understanding the influence of general activity on sociability and repetitive behaviors will increase the accuracy of interpretations of positive outcomes measured from pharmacological treatment that produces locomotor activating or sedating effects. In the present studies, dose-response curves for d-amphetamine (AMPH)-induced hyperlocomotion were similar in standard B6 mice and in the BTBR mouse model of autism. AMPH produced significant, robust reductions in the high level of repetitive self-grooming that characterizes BTBR, and also reduced the low baseline grooming in B6, indicating that AMPH-induced hyperlocomotion competes with time spent engaged in self-grooming. We then tested AMPH in B6 and BTBR on the 3-chambered social approach task. One component of sociability, the time spent in the chamber with the novel mouse, in B6 mice was reduced, while the sniffing time component of sociability in BTBR mice was enhanced. This finding replicated across multiple cohorts treated with AMPH and saline vehicle. In-depth analysis revealed that AMPH increased the number and decreased the duration of sniffing bouts in BTBR, suggesting BTBR treated with AMPH mostly engaged in brief sniffs rather than true social interactions with the novel mouse during the social approach task. Our data suggest that compounds with stimulant properties may have some direct benefits on reducing repetitive behaviors in autism spectrum disorders, particularly in the subset of autistic individuals with hyperactivity. This article is part of the Special Issue entitled 'Neurodevelopmental Disorders'.
23349489	β-Cells Are Not Generated in Pancreatic Duct Ligation-Induced Injury in Adult Mice.	The existence of adult β-cell progenitors remains the most controversial developmental biology topic in diabetes research. It has been reported that β-cell progenitors can be activated by ductal ligation-induced injury of adult mouse pancreas and apparently act in a cell-autonomous manner to double the functional β-cell mass within a week by differentiation and proliferation. Here, we demonstrate that pancreatic duct ligation (PDL) does not activate progenitors to contribute to β-cell mass expansion. Rather, PDL stimulates massive pancreatic injury, which alters pancreatic composition and thus complicates accurate measurement of β-cell content via traditional morphometry methodologies that superficially sample the pancreas. To overcome this potential bias, we quantified β-cells from the entire pancreas and observed that β-cell mass and insulin content are totally unchanged by PDL-induced injury. Lineage-tracing studies using sequential administration of thymidine analogs, rat insulin 2 promoter-driven cre-lox, and low-frequency ubiquitous cre-lox reveal that PDL does not convert progenitors to the β-cell lineage. Thus, we conclude that β-cells are not generated in injured adult mouse pancreas.
23358307	Synthesis, DNA binding and antitumor evaluation of styelsamine and cystodytin analogues.	A series of N-14 sidechain substituted analogues of styelsamine (pyrido[4,3,2-mn]acridine) and cystodytin (pyrido[4,3,2-mn]acridin-4-one) alkaloids have been prepared and evaluated for their DNA binding affinity and antiproliferative activity towards a panel of human tumor cell lines. Overall it was found that styelsamine analogues were stronger DNA binders, with the natural products styelsamines B and D having particularly high affinity (K(app) 5.33 × 10(6) and 3.64 × 10(6) M(-1), respectively). In comparison, the cystodytin iminoquinone alkaloids showed lower affinity for DNA, but were typically just as active as styelsamine analogues at inhibiting proliferation of tumor cells in vitro. Sub-panel selectivity towards non-small cell lung, melanoma and renal cancer cell lines were observed for a number of the analogues. Correlation was observed between whole cell activity and clogP, with the most potent antiproliferative activity being observed for 3-phenylpropanamide analogues 37 and 41 (NCI panel average GI(50) 0.4 μM and 0.32 μM, respectively) with clogP ~4.0-4.5.
17040106	Reductive detoxification of arylhydroxylamine carcinogens by human NADH cytochrome b5 reductase and cytochrome b5.	Heterocyclic and aromatic amine carcinogens are thought to lead to tumor initiation via the formation of DNA adducts, and bioactivation to arylhydroxylamine metabolites is necessary for reactivity with DNA. Carcinogenic arylhydroxylamine metabolites are cleared by a microsomal, NADH-dependent, oxygen-insensitive reduction pathway in humans, which may be a source of interindividual variability in response to aromatic amine carcinogens. The purpose of this study was to characterize the identity of this reduction pathway in human liver. On the basis of our findings with structurally similar arylhydroxylamine metabolites of therapeutic drugs, we hypothesized that the reductive detoxification of arylhydroxylamine carcinogens was catalyzed by NADH cytochrome b5 reductase (b5R) and cytochrome b5 (cyt b5). We found that reduction of the carcinogenic hydroxylamines of the aromatic amine 4-aminobiphenyl (4-ABP; found in cigarette smoke) and the heterocyclic amine 2-amino-1-methyl-6-phenylimidazo [4,5-b] pyridine (PhIP; found in grilled meats) was indeed catalyzed by a purified system containing only human b5R and cyt b5. Specific activities were 56-346-fold higher in the purified system as compared to human liver microsomes (HLM), with similar Michaelis-Menten constants (K(m) values) in both systems. The stoichiometry for b5R and cyt b5 that yielded the highest activity in the purified system was also similar to that found in native HLM ( approximately 1:8 to 1:10). Polyclonal antisera to either b5R or cyt b5 significantly inhibited N-hydroxy-4-aminobiphenyl (NHOH-4-ABP) reduction by 95 and 89%, respectively, and immunoreactive cyt b5 protein content in individual HLM was significantly correlated with individual reduction of both NHOH-4-ABP and N-hydroxy-PhIP (NHOH-PhIP). Finally, titration of HLM into the purified b5R/cyt b5 system did not enhance the efficiency of reduction activity. We conclude that b5R and cyt b5 are together solely capable of the reduction of arylhydroxylamine carcinogens, and we further hypothesize that this pathway may be a source of individual variability with respect to cancer susceptibility following 4-ABP or PhIP exposure.
23274058	Jaceosidin, isolated from dietary mugwort (Artemisia princeps), induces G2/M cell cycle arrest by inactivating cdc25C-cdc2 via ATM-Chk1/2 activation.	Jaceosidin, a flavonoid derived from Artemisia princeps (Japanese mugwort), has been shown to inhibit the growth of several human cancer cells, However, the exact mechanism for the cytotoxic effect of jaceosidin is not completely understood. In this study, we investigated the molecular mechanism involved in the antiproliferative effect of jaceosidin in human endometrial cancer cells. We demonstrated that jaceosidin is a more potent inhibitor of cell growth than cisplatin in human endometrial cancer cells. In contrast, jaceosidin-induced cytotoxicity in normal endometrial cells was lower than that observed for cisplatin. Jaceosidin induced G2/M phase cell cycle arrest and modulated the levels of cyclin B and p-Cdc2 in Hec1A cells. Knockdown of p21 using specific siRNAs partially abrogated jaceosidin-induced cell growth inhibition. Additional mechanistic studies revealed that jaceosidin treatment resulted in an increase in phosphorylation of Cdc25C and ATM-Chk1/2. Ku55933, an ATM inhibitor, reversed jaceosidin-induced cell growth inhibition, in part. Moreover, jaceosidin treatment resulted in phosphorylation of ERK, and pretreatment with the ERK inhibitor, PD98059, attenuated cell growth inhibition by jaceosidin. These data suggest that jaceosidin, isolated from Japanese mugwort, modulates the ERK/ATM/Chk1/2 pathway, leading to inactivation of the Cdc2-cyclin B1 complex, followed by G2/M cell cycle arrest in endometrial cancer cells.
22709946	Enhanced mGlu5-receptor dependent long-term depression at the Schaffer collateral-CA1 synapse of congenitally learned helpless rats.	Alterations of the glutamatergic system have been implicated in the pathophysiology and treatment of major depression. In order to investigate the expression and function of mGlu5 receptors in an animal model for treatment-resistant depression we used rats bred for congenital learned helplessness (cLH) and the control strain, bred for resistance against inescapable stress, congenitally. not learned helpless rats (cNLH). Western blot analysis showed an increased expression of mGlu5 (but not mGlu1a) receptors in the hippocampus of cLH rats, as compared with control cNLH rats. We also examined mGlu1/5 receptor signaling by in vivo measurement of DHPG-stimulated polyphosphoinositides hydrolysis. Stimulation of (3)H-inositolmonophosphate formation induced by i.c.v. injection of DHPG was enhanced by about 50% in the hippocampus of cLH rats. Correspondingly, DHPG-induced long-term depression (LTD) at Schaffer collateral/CA1 pyramidal cell synapses was amplified in hippocampal slices of cLH rats, whereas LTD induced by low frequency stimulation of the Schaffer collaterals did not change. Moreover, these effects were associated with decreased basal dendritic spine density of CA1 pyramidal cell in cLH rats. These data raise the attractive possibility that changes in the expression and function of mGlu5 receptors in the hippocampus might underlie the changes in synaptic plasticity associated with the depressive-like phenotype of cLH rats. However, chronic treatment of cLH rats with MPEP did not reverse learned helplessness, indicating that the enhanced mGlu5 receptor function is not the only player in the behavioral phenotype of this genetic model of depression. This article is part of a Special Issue entitled 'Metabotropic Glutamate Receptors'.
