20615127	Resistance to thyroid hormone due to a novel thyroid hormone receptor mutant in a patient with hypothyroidism secondary to lingual thyroid and functional characterization of the mutant receptor.	BACKGROUND: We describe a rare case of congenital hypothyroidism and an extremely high serum thyrotropin (TSH) level caused by a combination of resistance to thyroid hormone (RTH) and a lingual thyroid. As the RTH mutant, R316C, was new, the optimum dose of levothyroxine was unclear. To aid in assessment of the therapy, we characterized the mutant R316C thyroid hormone receptor (TR) and compared it with a common mutant, R316H, using in vitro studies. SUMMARY: The patient was a newborn female having severe hypothyroidism with a free thyroxine level of 0.36 ng/dL and a serum TSH level of 177 microU/mL. A scintiscan showed ectopic lingual thyroid tissue without a normal thyroid gland. Supplementation with levothyroxine at a dose of >350 microg/day did not normalize the serum TSH level; however, the patient showed normal growth and intelligence at 14 years of age. Consistent with the results of a computer analysis, the binding of R316C to triiodothyronine (T3) was significantly decreased to 38% that of the wild type. Electrophoretic mobility shift assay demonstrated that like R316H, R316C did not form a homodimer, but formed a heterodimer with RXR. However, a glutathione-S-transferase pull-down assay showed reduced binding of R316C with NCoR in the absence of T3 and impaired release in the presence of T3. In addition, transient transfection experiments demonstrated that unlike R316H, R316C had severe impairment of transcriptional activity on genes both positively and negatively regulated by thyroid hormone. It also had a clear dominant negative effect on genes negatively, but not positively, regulated by thyroid hormone, including the TSH-releasing hormone and TSHbeta genes. CONCLUSION: This is the first reported case of a R316C TR mutation. The characteristics of the R316C mutant differed from those of the R316H mutant. Our findings suggest that R316C causes reduced association with and impaired release of NCoR, resulting in RTH predominantly at the pituitary level, and that slightly elevated serum TSH level with high dose of levothyroxine might be optimum for normal growth.
10796631	Long acting beta-agonists versus theophylline for maintenance treatment of asthma.	BACKGROUND: Theophylline and long acting beta2-agonists are bronchodilators used for the management of persistent asthma symptoms, especially nocturnal asthma. They represent different classes of drug with differing side-effect profiles. OBJECTIVES: To assess the comparative efficacy, safety and side-effects of long-acting beta-agonists and theophylline in the maintenance treatment of asthma. SEARCH STRATEGY: Randomised, controlled trials (RCTs) were identified using the Cochrane Airways Group register. The register was searched using the following terms: asthma and theophylline and long acting beta-agonist or formoterol or foradile or eformoterol or salmeterol or bambuterol or bitolterol. Titles and abstracts were then screened to identify potentially relevant studies. The bibliography of each RCT was searched for additional RCTs. Authors of identified RCTs were contacted for other relevant published and unpublished studies. SELECTION CRITERIA: All included studies were RCTs involving adults and children with clinical evidence of asthma. These studies must have compared oral sustained release and/or dose adjusted theophylline with an inhaled long-acting beta-agonist. DATA COLLECTION AND ANALYSIS: Potentially relevant trials, identified by screening titles and/or abstracts, were obtained. Two reviewers independently assessed full text versions of these trials to decided whether the trial should be included in the review, and assessed its methodological quality. Where there was disagreement between reviewers, this was resolved by consensus, or reference to a third party. Data were extracted by two independent reviewers. Inter-rater reliability was assessed by simple agreement. Study authors were contacted to clarify randomisation methods, provide missing data, verify the data extracted and identify unpublished studies. Relevant pharmaceutical manufacturers were also contacted. MAIN RESULTS: Six trials met the inclusion criteria. Five used salmeterol and one, biltoterol. They were of varying quality. There was a trend for salmeterol to improve FEV1 more than theophylline in three studies and salmeterol use was associated with more symptom free nights. Bitolterol, used in only one study, was reported to be less effective than theophylline. Subjects taking salmeterol experienced fewer adverse events than those using theophylline (Relative Risk 0.38; 95%Confidence Intervals 0.25, 0.57). Significant reductions were reported for central nervous system adverse events (Relative Risk 0.51; 95%Confidence Intervals 0.30, 0.88) and gastrointestinal adverse events (Relative Risk 0.32; 95%Confidence Intervals 0.17, 0.59). REVIEWER'S CONCLUSIONS: Salmeterol may be more effective than theophylline in reducing asthma symptoms including night waking and improving lung function. More adverse events occurred in subjects using theophylline when compared to salmeterol.
17594192	Phenserine.	Phenserine, a derivative of physostigmine, was first described as an inhibitor of acetylcholinesterase (AChE) and was shown to improve cognition in various experimental paradigms in rodents and dogs. It was clinically tested for Alzheimer's disease, with moderate success in initial Phase II studies. Phenserine deserves attention for an additional quality of action: in addition to inhibiting AChE, it modulates the amount of beta-amyloid precursor protein (APP) in neuronal cell culture by reducing APP translation. This effect probably involves interaction of phenserine with a regulatory element in the 5'-untranslated region of the APP gene that controls APP expression. Phenserine apparently reduces translational efficiency of APP mRNA into protein, a process that may involve an interaction with iron and/or an iron-responsive element. As a consequence, phenserine reduces beta-amyloid peptide (Abeta) formation in vitro and in vivo. Phenserine is also unique because of differing actions of its enantiomers: (-)-phenserine is the active enantiomer for inhibition of AChE, whereas (+)-phenserine ('posiphen') has weak activity as an AChE inhibitor and can be dosed much higher. Both enantiomers are equipotent in downregulating APP expression. (+)-Posiphen may be a promising drug, either alone or in combination with (-)-phenserine, to attenuate the progression of Alzheimer's disease.
23526644	Inhibition of Ebola Virus Infection: Identification of Niemann-Pick C1 as the Target by Optimization of a Chemical Probe.	A high throughput screen identified adamantane dipeptide 1 as an inhibitor of Ebola virus (EboV) infection. Hit-to-lead optimization to determine the structure-activity relationship (SAR) identified the more potent EboV inhibitor 2 and a photoaffinity labeling agent 3. These anti-viral compounds were employed to identify the target as Niemann-Pick C1 (NPC1), a host protein that binds the EboV glycoprotein and is essential for infection. These studies establish NPC1 as a promising target for anti-viral therapy.
23290724	Zinc drives a tertiary fold in the prion protein with familial disease mutation sites at the interface.	The cellular prion protein PrP(C) consists of two domains--a flexible N-terminal domain, which participates in copper and zinc regulation, and a largely helical C-terminal domain that converts to β sheet in the course of prion disease. These two domains are thought to be fully independent and noninteracting. Compelling cellular and biophysical studies, however, suggest a higher order structure that is relevant to both PrP(C) function and misfolding in disease. Here, we identify a Zn²⁺-driven N-terminal to C-terminal tertiary interaction in PrP(C). The C-terminal surface participating in this interaction carries the majority of the point mutations that confer familial prion disease. Investigation of mutant PrPs finds a systematic relationship between the type of mutation and the apparent strength of this domain structure. The structural features identified here suggest mechanisms by which physiologic metal ions trigger PrP(C) trafficking and control prion disease.
17632107	Ligand-dependent transcriptional activities of four torafugu pufferfish Takifugu rubripes peroxisome proliferator-activated receptors.	Structural and functional properties were investigated for four peroxisome proliferator-activated receptors (PPARs), PPARalpha1, PPARalpha2, PPARbeta, and PPARgamma, from torafugu pufferfish Takifugu rubripes and determined for their transcriptional activity by the reporter assay using reporter plasmids containing three copies of the acyl-CoA oxidase PPAR response element. Although torafugu PPARs showed a high similarity in the primary structure to other vertebrate counterparts, torafugu PPARalpha2 and gamma contained additional sequences of 21 and 28 amino acids, respectively, as in the case of other teleost fish species when compared with African clawed frog counterparts. The transcriptional activity of torafugu PPARalpha1 was enhanced 4.5- and 11.5-fold by Wy-14643 and 5,8,11,14-eicosatetraynoic acid (ETYA) each at 10 microM, respectively, whereas that of PPARalpha2, 4.5- and 7.3-fold at the same concentration of the respective ligands, respectively. The activities of torafugu PPARalpha1 and alpha2 were also enhanced 5.6- and 6.3-fold by ETYA at 1 microM, respectively, but not by Wy-14643 at this concentration. Furthermore, the activities of the two torafugu PPARalphas were enhanced 4.3- and 7.6-fold by arachidonic acid, 4.4- and 5.2-fold by docosahexaenoic acid, and 6.7- and 8.0-fold by eicosapentaenoic acid each at 50 microM, respectively. On the other hand, the activities of torafugu PPARbeta and gamma were not changed by Wy-14643, ETYA, rosiglitazone, nor PUFAs. These results suggest that the activities of torafugu PPARbeta and gamma require undefined ligands. Alternatively, the molecular mechanisms involved in their activation are different from those of other vertebrates.
20012638	Effects of bambuterol and terbutaline on isolated rat's tracheal smooth muscle.	Terbutaline (Bricanyl) and its prodrug Bambuterol (Bambec) are highly potent beta(2)-adrenoceptor agonists often used in asthma patients. Terbutaline in the form of inhaled short-acting bronchodilator relieves asthmatic symptoms. However, the effects of bambuterol given intratracheally have rarely been explored. To verify the effect of bambuterol and terbutaline, which act on the tracheal smooth muscle directly in vitro, we used our preparation to test the effects of bambuterol on isolated rat's tracheal smooth muscle compared with terbutaline. The following assessments of bambuterol and terbutaline were performed: (1) effect on tracheal smooth muscle resting tension; (2) effect on contraction caused by 10(-6) M methacholine as a parasympathetic mimetic; (3) effect of the drugs on electrically induced tracheal smooth muscle contractions. The results indicated that adding bambuterol induced a significant further contraction to 10(-6) M methacholine-induced contraction when the preparation was increased to 10(-4) M. But terbutaline elicited a relaxation response at a dose of 10(-6) M or more. Both bambuterol and terbutaline could inhibit electrical field stimulation (EFS) induced spike contraction. Terbutaline had an anti-cholinergic effect that could relieve asthmatic symptoms. But the effect of bambuterol acting on tracheal smooth muscle directly was controversial.
23500061	Anti-apoptotic cardioprotective effects of SHP-1 gene silencing against ischemia-reperfusion injury: Use of deoxycholic acid-modified low molecular weight polyethyleneimine as a cardiac siRNA-carrier.	The cardiomyocyte apoptosis plays a critical role in the development of myocardial injury after ischemia and reperfusion. Thus, alteration of the major apoptosis-regulatory factors during myocardial ischemia-reperfusion is expected to have favorable cardioprotective effects. Herein, we report ischemic-reperfused myocardial infarction (MI) repair with siRNA against Src homology region 2 domain-containing tyrosine phosphatase-1 (SHP-1), which is known as a key factor involved in regulating the progress of apoptosis in many cell types. A low molecular weight polyethyleneimine modified with deoxycholic acid (PEI1.8-DA)-based delivery strategy was suggested for the cardiac application of SHP-1 siRNA to overcome the poor gene delivery efficiency to myocardium due to the highly charged structures of the compact cardiac muscles. The PEI1.8-DA conjugates formed stable nanocomplexes with SHP-1 siRNA via electrostatic and hydrophobic interactions. The PEI1.8-DA/SHP-1 siRNA polyplexes effectively silenced SHP-1 gene expression in cardiomyocytes, leading to a significant inhibition of cardiomyocyte apoptosis under hypoxia. In comparison to conventional gene carriers, relatively large amounts of siRNA molecules remained after treatment with the PEI1.8-DA/SHP-1 siRNA polyplexes. Cardiac administration of the PEI1.8-DA/SHP-1 siRNA polyplexes resulted in substantial improvement in SHP-1 gene silencing, which can be explained by the enhancement of cardiac delivery efficiency of the PEI1.8-DA conjugates. In addition, in vivo treatment with the PEI1.8-DA/SHP-1 siRNA polyplexes induced a highly significant reduction in myocardial apoptosis and infarct size in rat MI models. These results demonstrate that the PEI1.8-DA/SHP-1 siRNA polyplex formulation is a useful system for efficient gene delivery into the compact myocardium that provides a fundamental advantage in treating ischemic-reperfused MI.
20091113	Polymorphisms in dopamine transporter (SLC6A3) are associated with stimulant effects of D-amphetamine: an exploratory pharmacogenetic study using healthy volunteers.	Individuals vary in their subjective responses to stimulant drugs, and these differences are believed to be partially genetic in origin. We evaluated associations between mood, cognitive and cardiovascular responses to d-amphetamine and four polymorphisms in the dopamine transporter (SLC6A3): rs460000, rs3756450, rs37022 and rs6869645. Healthy Caucasian male and female volunteers (N = 152) participated in a double-blind, crossover design study in which they received placebo, 10 and 20 mg of d-amphetamine. We measured self-reported rating of mood, performance on the Digit Symbol Substitution Task, blood pressure and heart rate. Individuals with the C/C genotype at rs460000 (N = 83) reported approximately twofold higher ratings of stimulation and euphoria relative to the A/A+A/C (N = 69) genotype group, at both the 10 and 20 mg doses. No other responses or SNPs showed significant effects. rs460000 is in perfect LD with rs463379 (CEU: D' = 1; r (2) = 1), which was not studied here, but has been associated with etiology of Attention Deficit Hyperactivity Disorder (ADHD). These findings suggest a pleiotropic effect of this polymorphic locus on both ADHD and sensitivity to the subjective effects of amphetamine.
22835278	Leydig cell hyperplasia and Leydig cell tumour in postmenopausal women: report of two cases.	Leydig cell hyperplasia and Leydig cell tumours of the ovary are rare. We present two cases in which patients had increased blood levels of testosterone and frank hirsutism. Imaging showed minimal abnormalities. After adrenal disease had been ruled out, they underwent a bilateral oophorectomy. One case showed a Leydig cell hyperplasia, the other a Leydig cell tumour. An androgen producing tumour should be excluded in every woman with evidence of hirsutism or frank virilization and markedly elevated testosterone levels. Adrenal disease with androgen hypersecretion can be suspected by detailed clinical, laboratory and radiologic imaging. Although DHEAS has a good sensitivity in the detection of adrenal origin of hyperandrogenism (and hence a good negative predictive value) it is not specific (specificity ranging from 85 to 98%). Imaging of the ovaries can be helpful but does not rule out ovarian disease if normal. Indeed, diffuse stromal Leydig cell hyperplasia and Leydig cell tumours (usually small) may escape imaging and in some cases diagnosis can only be made on pathology. As these clinical entities represent a diagnostic and therapeutic challenge, oophorectomy should be considered in postmenopausal women with hirsutism and elevated testosterone levels, after the exclusion of adrenal causes. The procedure is relatively safe and effective. Follow-up remains indicated.
19244097	Studies of the biogenic amine transporters. 13. Identification of "agonist" and "antagonist" allosteric modulators of amphetamine-induced dopamine release.	Recent studies identified novel allosteric modulators of the dopamine (DA) transporter (DAT). N-(Diphenylmethyl)-2-phenyl-4-quinazolinamine (SoRI-9804), N-(2,2-diphenylethyl)-2-phenyl-4-quinazolinamine (SoRI-20040), and N-(3,3-diphenylpropyl)-2-phenyl-4-quinazolinamine (SoRI-20041) partially inhibited [(125)I]3beta-(4'-iodophenyl)tropan-2beta-carboxylic acid methyl ester (RTI-55) binding, slowed the dissociation rate of [(125)I]RTI-55 from the DAT, and partially inhibited [(3)H]dopamine uptake. In the present study, we report that SoRI-9804 and SoRI-20040, at doses that do not alter release, partially inhibited d-amphetamine-induced DAT-mediated release of [(3)H]1-methyl-4-phenylpyridinium (MPP(+))or[(3)H]dopamine from striatal synaptosomes ("DAT-mediated DA release") in a dose-dependent manner. SoRI-20041, which does not alter DAT-mediated DA release measured with [(3)H]DA, reversed the effect of SoRI-20040. SoRI-20040 and SoRI-9804 also partially inhibited DAT-mediated DA release induced by DA or (+/-)-3,4-methylenedioxyamphetamine, demonstrating that the observed partial inhibition is not specific for a particular DAT substrate. SoRI-9804 and SoRI-20040 did not attenuate D-amphetamine-induced release of [(3)H]5-hydroxytryptamine from serotonergic, or [(3)H]MPP(+) from noradrenergic, nerve terminals. Kinetic experiments demonstrated that SoRI-9804, in contrast to cocaine, slowed D-amphetamine-induced release of [(3)H]MPP(+) from dopaminergic nerve terminals without altering the apparent rate constants. The two major findings of this study are 1) the identification of both "agonist" (SoRI-9804 and SoRI-20040) and "antagonist" (SoRI-20041) allosteric modulators of D-amphetamine-induced DAT-mediated DA release and 2) [(3)H]DA uptake and d-amphetamine-induced DAT-mediated efflux can be separately modulated. Such agents may have therapeutic potential for the treatment of stimulant addiction, Parkinson's disease, and other psychiatric disorders.
15494035	Amylin receptors: molecular composition and pharmacology.	Several receptors which bind the hormone AMY (amylin) with high affinity have now been identified. The minimum binding unit is composed of the CT (calcitonin) receptor at its core, plus a RAMP (receptor activity modifying protein). The receptors have been named AMY(1(a)), AMY(2(a)) and AMY(3(a)) in accordance with the association of the CT receptor (CT((a))) with RAMP1, RAMP2 and RAMP3 respectively. The challenge is now to determine the localization and pharmacological nature of each of these receptors. Recent attempts to achieve these aims will be briefly discussed.
11344206	Evidence for genetic heterogeneity of pseudohypoaldosteronism type 1: identification of a novel mutation in the human mineralocorticoid receptor in one sporadic case and no mutations in two autosomal dominant kindreds.	Pseudohypoaldosteronism type 1 (PHA1) is characterized by neonatal salt wasting resistant to mineralocorticoids. There are 2 forms of PHA1: the autosomal recessive form with symptoms persisting into adulthood, caused by mutations in the amiloride-sensitive luminal sodium channel, and the autosomal dominant or sporadic form, which shows milder symptoms that remit with age. Mutations in the gene encoding the human mineralocorticoid receptor (hMR) are, at least in some patients, responsible for the latter form of PHA1. We here report the results of a genetic study in a sporadic case and in 5 affected patients from 2 families with autosomal dominant PHA1. In the sporadic case we identified a new frameshift mutation, Ins2871C, in exon 9 of the hMR gene. Family members were asymptomatic and had no mutation. This mutation is the first described in exon 9 and impairs the last 27 amino acids of the hormone-binding domain. In 2 kindreds with autosomal dominant PHA1 we found no mutation of the hMR gene. Our results confirm the hypothesis that autosomal dominant or sporadic PHA1 is a genetically heterogeneous disease involving other, as yet unidentified, genes.
23500776	EROD activity induction in peripheral blood lymphocytes, liver and brain tissues of rats orally exposed to polycyclic aromatic hydrocarbons.	Little is known in terms of multi-matrix cytochrome P450 activity induction under repeated oral exposure to planar halogenated and polycyclic aromatic hydrocarbons (PHH, PAH). In the present study, 60 rats were daily exposed, during 28days, to oral ingestion of a mixture consisting of phenanthrene, pyrene and benzo(a)pyrene at 0, 6 or 600μg/day. EROD activity, reflecting almost exclusively CYP1A1 and CYP1B1 activities, was measured in brain and liver microsomes as well as in peripheral blood lymphocytes (PBLs). All induction kinetics could be appropriately fitted using logistic-like models. After 28days of exposure to a 6μg/day dose, EROD activity was found to be 91, 152 and 94-fold increased in lymphocytes, liver and brain, respectively, compared to day 0. Plateau activities could be appropriately fitted versus ingested doses using Hill or Michaelis-Menten models. Correlations between matrices made it possible to conclude that EROD activity in PBL should be considered as a sensitive, convenient and non-destructive approach for (i) evaluating EROD activity in liver, which was found to represent 98% of the observed EROD activities in the three tested matrices and (ii) evaluating oral exposure of homogeneous groups of farm animals (race, diet) to CYP inducing PAH and PHH.
12414329	Phosphodiesterase type 5 as a pharmacologic target in erectile dysfunction.	The scientific rationale of pharmacologically inhibiting phosphodiesterase type 5 (PDE5) in the treatment of erectile dysfunction (ED) is reviewed. Published literature on the nitric oxide-cyclic guanosine monophosphate (cGMP) pathway for penile erection and on PDE5 inhibition using sildenafil as the model for pharmacologic PDE5 inhibition are assessed. The key second messenger in the mediation of penile erection is cGMP. PDE5 is the predominant PDE in the corpus cavernosum, and cGMP is its primary substrate. Therefore, in men with ED, elevation of cGMP in corpus cavernosal tissue via selective inhibition of cGMP-specific PDE5 is a means of improving erectile function at minimal risk of adverse events. This approach is validated by the clinical efficacy and safety of sildenafil, the pioneering drug for selective PDE5 inhibitor therapy for ED. Sildenafil exhibits inhibitory potency against PDE5 and a 10-fold lower dose-related inhibitory potency against rod outer segment PDE6, the predominant PDE in the phototransduction cascade in rods. Thus, its pharmacologic profile is predictable, with close correlation between pharmacodynamic and pharmacokinetic properties. Clinically, sildenafil improves erectile function in a large percentage of men with ED. The most common adverse events are due to PDE5 inhibition in vascular and visceral smooth muscle; similar adverse events are expected during therapeutic use of all PDE5 inhibitors. As free sildenafil plasma concentrations approach concentrations sufficient to inhibit retinal PDE6, usually at higher therapeutic doses, transient, reversible visual adverse events can occur, albeit infrequently. Selective inhibition of PDE5 is a rational therapeutic approach in ED, as proved by the clinical success of sildenafil.
