12827214	Pharmacological characterization of unique prazosin-binding sites in human kidney.	In human kidney, we found unique prazosin-binding sites that were insensitive to phentolamine and were thus unlikely to be alpha(1)-adrenoceptors. As the binding of [(3)H]prazosin to phentolamine-insensitive sites was prevented by 100 microM guanabenz, the insensitive sites were evaluated by subtracting [(3)H]prazosin binding in the presence of 100 microM guanabenz from that in the presence of 10 microM phentolamine. [(3)H]Prazosin bound to the phentolamine-insensitive sites monophasically with a high affinity (pK(d); 9.1+/-0.08, n=8), and the B(max) value (814+/-204 fmol mg(-1) protein, n=8) was more than ten times that of the phentolamine-sensitive alpha(1)-adrenoceptor (pK(d)=9.9+/-0.13, B(max)=66+/-23 fmol mg(-1) protein, n=7). The phentolamine-insensitive sites in human kidney were highly sensitive to other quinazoline derivatives such as terazosin and doxazosin. However, other alpha(1)-adrenoceptor antagonists (tamsulosin, WB4101 and corynanthine) did not inhibit the binding at a range of concentrations that generally exhibit alpha(1)-adrenoceptor antagonism, and noradrenaline, rauwolscine and propranolol were without effect on the [(3)H]prazosin binding. On the other hand, ligands for the renal Na(+)-transporter (amiloride and triamterene) and for imidazoline recognition sites (guanabenz, guanfacine and agmatine) displaced the binding of [(3)H]prazosin to phentolamine-insensitive sites at micromolar concentrations. Photoaffinity labeling with [(125)I]iodoarylazidoprazosin showed phentolamine-insensitive labeling at around 100 kDa, a molecular size larger than that of human alpha(1a)- and alpha(1b)-adrenoceptors expressed in 293 cells (50-60 and 70-80 kDa, respectively) on electrophoresis. In contrast, there was no detectable phentolamine-insensitive binding site but were phentolamine-sensitive alpha(1)-adrenoceptors in human liver (pK(d)=10.0+/-0.06, B(max)=44+/-6 fmol mg(-1) protein, n=3). Phentolamine-insensitive prazosin binding sites were also detected in rabbit kidney (approximately 50% of specific binding sites) but were minor in rat kidney (less than 20%). In conclusion, there are unique prazosin-binding sites in human kidney, the pharmacological profiles of which were distinct from those of known adrenoceptors.
23583257	Quinone compounds regulate the level of ROS production by the NADPH oxidase Nox4.	NADPH oxidase Nox4 is expressed in a wide range of tissues and plays a role in cellular signaling by providing reactive oxygen species (ROS) as intracellular messengers. Nox4 oxidase activity is thought to be constitutive and regulated at the transcriptional level; however, we challenge this point of view and suggest that specific quinone derivatives could modulate this activity. In fact, we demonstrated a significant stimulation of Nox4 activity by 4 quinone derivatives (AA-861, tBuBHQ, tBuBQ, and duroquinone) observed in 3 different cellular models, HEK293E, T-REx™, and chondrocyte cell lines. Our results indicate that the effect is specific toward Nox4 versus Nox2. Furthermore, we showed that NAD(P)H:quinone oxidoreductase (NQO1) may participate in this stimulation. Interestingly, Nox4 activity is also stimulated by reducing agents that possibly act by reducing the disulfide bridge (Cys226, Cys270) located in the extracellular E-loop of Nox4. Such model of Nox4 activity regulation could provide new insight into the understanding of the molecular mechanism of the electron transfer through the enzyme, i.e., its potential redox regulation, and could also define new therapeutic targets in diseases in which quinones and Nox4 are implicated.
21606412	Activity of XL184 (Cabozantinib), an oral tyrosine kinase inhibitor, in patients with medullary thyroid cancer.	PURPOSE: XL184 (cabozantinib) is a potent inhibitor of MET, vascular endothelial growth factor receptor 2 (VEGFR2), and RET, with robust antiangiogenic, antitumor, and anti-invasive effects in preclinical models. Early observations of clinical benefit in a phase I study of cabozantinib, which included patients with medullary thyroid cancer (MTC), led to expansion of an MTC-enriched cohort, which is the focus of this article. PATIENTS AND METHODS: A phase I dose-escalation study of oral cabozantinib was conducted in patients with advanced solid tumors. Primary end points included evaluation of safety, pharmacokinetics, and maximum-tolerated dose (MTD) determination. Additional end points included RECIST (Response Evaluation Criteria in Solid Tumors) response, pharmacodynamics, RET mutational status, and biomarker analyses. RESULTS: Eighty-five patients were enrolled, including 37 with MTC. The MTD was 175 mg daily. Dose-limiting toxicities were grade 3 palmar plantar erythrodysesthesia (PPE), mucositis, and AST, ALT, and lipase elevations and grade 2 mucositis that resulted in dose interruption and reduction. Ten (29%) of 35 patients with MTC with measurable disease had a confirmed partial response. Overall, 18 patients experienced tumor shrinkage of 30% or more, including 17 (49%) of 35 patients with MTC with measurable disease. Additionally, 15 (41%) of 37 patients with MTC had stable disease (SD) for at least 6 months, resulting in SD for 6 months or longer or confirmed partial response in 68% of patients with MTC. CONCLUSION: Cabozantinib has an acceptable safety profile and is active in MTC. Cabozantinib may provide clinical benefit by simultaneously targeting multiple pathways of importance in MTC, including MET, VEGFR2, and RET. A global phase III pivotal study in MTC is ongoing (ClinicalTrials.gov number NCT00215605).
1375507	Prostacyclin analogues inhibit tissue factor expression in the human monocytic cell line THP-1 via a cyclic AMP-dependent mechanism.	Increased expression of tissue factor procoagulant by peripheral blood monocytes has been implicated in a number of thrombotic disorders. The present studies were undertaken to determine whether stable analogues of prostacyclin, a potent endothelium-derived platelet inhibitor and vasodilator, could inhibit tissue factor expression by human monocytic cells. Exposure of monocytic tumor THP-1 cells to 100 ng/ml endotoxin, 2 units/ml interleukin-1 beta, or 5 ng/ml tumor necrosis factor-alpha for 4 hours led to increased tissue factor procoagulant activity. Preincubation for 30 minutes with iloprost, ciprostene, and carbacyclin led to a dose-dependent inhibition of tissue factor expression induced by all three challenging agents. Iloprost was the most potent: 50% inhibition occurred at 5 nM, a concentration close to the reported dissociation constant for iloprost binding to the platelet prostacyclin receptor. An orally active analogue, cicaprost, was equally effective against endotoxin-induced tissue factor expression. Carbacyclin and ciprostene were 100 times less potent. Iloprost prevented the endotoxin-induced expression of tissue factor antigen on the surface of THP-1 cells, as determined by flow cytometry. Iloprost (500 pM-50 nM) increased intracellular levels of cyclic AMP. This effect was potentiated by isobutylmethylxanthine, an inhibitor of phosphodiesterase. The inhibitory effects of iloprost on tissue factor expression were also potentiated by isobutylmethylxanthine and mimicked by forskolin and dibutyryl cyclic AMP but not dibutyryl cyclic GMP. These results suggest that prostacyclin may play a role in downregulating tissue factor expression in monocytes, at least in part via elevation of intracellular levels of cyclic AMP.
23479193	Synthesis and in-silico studies of some diaryltriazole derivatives as potential cyclooxygenase inhibitors.	The synthesis of several 4-phenyl-5-pyridin-4-yl-2,3-dihydro-3H-1,2,4-triazole-3-thiones possessing N-2 Mannich bases or S-alkyl substituents, is reported. Several of them exhibited a low nanomolar COX enzyme inhibition activity. Most of the compounds showed inhibition of edema was similar to that evoked by celocoxib in animal model. Molecular docking studies of the compounds into the binding sites of COX-1 and COX-2 allowed us to shed light on the binding mode of these novel COX inhibitors.
11585753	The tyrosine kinase inhibitor ZD1839 ("Iressa") inhibits HER2-driven signaling and suppresses the growth of HER2-overexpressing tumor cells.	The epidermal growth factor receptor (EGFR) is commonly overexpressed in many human tumors and provides a new target for anticancer drug development. ZD1839 ("Iressa"), a quinazoline tyrosine kinase inhibitor selective for the EGFR, has shown good activity in preclinical studies and in the early phase of clinical trials. However, because it remains unclear which tumor types are the best targets for treatment with this agent, the molecular characteristics that correlate with tumor sensitivity to ZD1839 have been studied. In a panel of human breast cancer and other epithelial tumor cell lines, HER2-overexpressing tumors were particularly sensitive to ZD1839. Growth inhibition of these tumor cell lines was associated with the dephosphorylation of EGFR, HER2, and HER3, accompanied by the loss of association of HER3 with phosphatidylinositol 3-kinase, and down-regulation of Akt activity. These studies suggest that HER2-overexpressing tumors are particularly susceptible to the inhibition of HER family tyrosine kinase signaling and suggest novel strategies to treat these particularly aggressive tumors.
3994963	Drug-protein interactions: isolation and characterization of covalent adducts of phenoxybenzamine and calmodulin.	Phenoxybenzamine, an alpha-adrenergic antagonist containing a (chloroethyl)amine group, labels calmodulin in the presence of calcium. The covalent interaction is inhibited by chlorpromazine in a concentration-dependent manner. Adducts of calmodulin and phenoxybenzamine were separated by high-performance liquid chromatography into four major fractions: two containing 0.6 and 1.2 mol of drug per mol of protein and two different fractions each containing 2.0 mol/mol. Each adduct had a reduced ability to activate cyclic nucleotide phosphodiesterase and myosin light chain kinase, and the chlorpromazine binding capacities of the phenoxybenzamine-calmodulin adducts were diminished to the extent of phenoxybenzamine incorporation into each adduct. Isolation and characterization of labeled peptides from phenoxybenzamine-modified calmodulins indicated that peptides encompassing residues 38-75, 107-126, and 127-148 contained phenoxybenzamine label. These studies directly demonstrate the relatedness between the binding activities of two structurally dissimilar calmodulin antagonists, demonstrate that covalent adducts of calmodulin and drugs with equal stoichiometries of labeling can have quantitative differences in activity and sites of modification, and provide direct evidence of distinct drug binding regions in calmodulin located in the amphipathic alpha-helical regions of the second and fourth domains.
17311416	Pre-steady-state currents in neutral amino acid transporters induced by photolysis of a new caged alanine derivative.	Na+-Dependent transmembrane transport of small neutral amino acids, such as glutamine and alanine, is mediated, among others, by the neutral amino acid transporters of the solute carrier 1 [SLC1, alanine serine cysteine transporter 1 (ASCT1), and ASCT2] and SLC38 families [sodium-coupled neutral amino acid transporter 1 (SNAT1), SNAT2, and SNAT4]. Many mechanistic aspects of amino acid transport by these systems are not well-understood. Here, we describe a new photolabile alanine derivative based on protection of alanine with the 4-methoxy-7-nitroindolinyl (MNI) caging group, which we use for pre-steady-state kinetic analysis of alanine transport by ASCT2, SNAT1, and SNAT2. MNI-alanine has favorable photochemical properties and is stable in aqueous solution. It is also inert with respect to the transport systems studied. Photolytic release of free alanine results in the generation of significant transient current components in HEK293 cells expressing the ASCT2, SNAT1, and SNAT2 proteins. In ASCT2, these currents show biphasic decay with time constants, tau, in the 1-30 ms time range. They are fully inhibited in the absence of extracellular Na+, demonstrating that Na+ binding to the transporter is necessary for induction of the alanine-mediated current. For SNAT1, these transient currents differ in their time course (tau = 1.6 ms) from previously described pre-steady-state currents generated by applying steps in the membrane potential (tau approximately 4-5 ms), indicating that they are associated with a fast, previously undetected, electrogenic partial reaction in the SNAT1 transport cycle. The implications of these results for the mechanisms of transmembrane transport of alanine are discussed. The new caged alanine derivative will provide a useful tool for future, more detailed studies of neutral amino acid transport.
18439678	Porcine TLR8 and TLR7 are both activated by a selective TLR7 ligand, imiquimod.	Toll-like receptors (TLRs) are a family of highly conserved germline-encoded pattern-recognition receptors (PRR), which are utilized by the innate immune system to recognize microbial components, known as pathogen-associated molecular patterns (PAMP). We cloned and characterized porcine TLR7 and TLR8 genes from pig lymph node tissue. Sequence analysis showed that the aa sequence identities of porcine TLR7 with human, mouse and bovine TLR7 are 85, 78 and 90%, respectively, whereas porcine TLR8 aa sequence identities with human, mouse and bovine TLR8 are 73, 69 and 79%, respectively. Both porcine TLR7 and TLR8 proteins were expressed in cell lines and were N-glycosylated. The stimulatory activity of TLR7 and TLR8 ligands to porcine and human TLR7 and TLR8 in transiently transfected Cos-7 and 293T cells were analyzed using a NF-kappaB reporter assay. Two imidazoquinoline molecules, imiquimod and gardiquimod, markedly activated both porcine TLR7 and TLR8 whereas only human TLR7, but not TLR8, was activated by the ligands. Therefore, receptor specificity for porcine TLR8 is clearly species specific. We further showed that porcine TLR7 and TLR8 are located intracellularly and are mainly within the endoplasmic reticulum. Moreover, activation of transfected cells and porcine PBMC by TLR7 ligands was inhibited by bafilomycin A(1) indicating the requirement of endosomal/lysosomal acidification for activation of the receptors.
7837275	Conformational transitions linked to active site ligation in human thrombin: effect on the interaction with fibrinogen and the cleavable platelet receptor.	An experimental strategy based on solution viscosity perturbation allowed us to study the energetics of amide-substrates, p-aminobenzamidine (p-ABZ) and proflavin binding to the catalytic site of two proteolyzed forms of alpha-thrombin, i.e. zeta- and gamma T-thrombin. These thrombin derivatives are cleaved at the Leu144-Gly150 loop and at the fibrinogen recognition exosite (FRS), respectively. A phenomenological analysis of thermodynamic data showed that the amide substrates and p-ABZ interactions with zeta-thrombin were respectively, associated with a chemical compensation (i.e. the linear relationship between entropy and enthalpy of binding) and a hydrophobic phenomenon (i.e. a change in the standard heat capacity). The latter was slightly lower than that previously observed for a alpha-thrombin (0.78 +/- 0.25 versus 1.01 +/- 0.17 kcal/mol K). Both phenomenon were absent in gamma T-thrombin. The interaction of a alpha-, zeta- and gamma T-thrombin with macromolecular substrates that "bridge-bind" to both the catalytic site (CS) and fibrinogen recognition exosite (FRS), such as fibrinogen and the cleavable platelet receptor (CPR), was also evaluated. These interactions were studied by following fibrinopeptide A (FpA) release and by measuring intraplatelet Ca2+ changes induced by thrombin-CPR interaction. It was found that the free energy of activation (RT ln Kcat/Km) for both fibrinogen and CPR hydrolysis followed the same hierarchy, i.e. alpha > zeta > gamma. Moreover, the values of delta Cp for alpha-, zeta- and gamma T-thrombin interaction with p-ABZ were found to be linearly correlated to the free energy of activation for both fibrinogen and CPR cleavage. In conclusion, these data demonstrate that: (1) the Leu144-Gly150 loop and the FRS are both involved in the conformational transition linked to the binding of p-aminobenzamidine to the thrombin active site; (2) the extent of thrombin's capacity to undergo conformational transitions in alpha-, zeta- and gamma T forms is positively correlated to the free energy of activation for hydrolysis of macromolecular substrates interacting with both the catalytic domain and the FRS.
8384716	Molecular cloning and functional expression of 5-HT1E-like rat and human 5-hydroxytryptamine receptor genes.	Sequential polymerase chain reaction experiments were performed to amplify a unique sequence representing a guanine nucleotide-binding protein (G-protein)-coupled receptor from rat hypothalamic cDNA. Degenerate oligonucleotides corresponding to conserved amino acids from transmembrane domains III, V, and VI of known receptors [5-HT1A, 5-HT1C, and 5-HT2; 5-HT is serotonin (5-hydroxytryptamine)] were used as primers for the sequential reactions. The resulting product was subcloned and used to screen a rat genomic library to identify a full-length clone (MR77) containing an intronless open reading frame encoding a 366-amino acid seven-transmembrane domain protein. The human homolog was isolated, and its encoded protein had 93% overall amino acid identity with the rat sequence. Within the conserved transmembrane domains, the sequences exhibit approximately 52%, 59%, 65%, and 68% amino acid identity with the known rat 5-HT1A, rat 5-HT1B, rat 5-HT1D, and human 5-HT1E receptors, respectively. MR77 was subcloned into a eukaryotic expression vector system and expressed in CosM6 cells. Studies on broken cell preparations indicate that the expressed receptor exhibits 125I-labeled d-lysergic acid diethylamide (LSD) binding that can be displaced by serotonin but not by other biogenic amines. The specific binding is displaced by the selective 5-HT1D agonist sumatriptan but not by the mixed 5-HT1A/1D agonist 5-carboxyamidotryptamine. 125I-labeled LSD binding was competitively antagonized by the ergot alkaloids methysergide and ergotamine. HeLa cells transfected with the MR77 gene exhibited inhibition of adenylate cyclase in response to serotonin. MR77 is expressed at low levels throughout the brain, with the greatest expression in the cortex, hippocampus, and striatum. MR77 thus represents a 5-HT receptor of the 5-HT1 class, and we propose that, based on the pharmacological characterization, MR77 represents an additional 5-HT1E-like receptor.
12373557	Stereospecific inhibition of monoamine uptake transporters by meta-hydroxyephedrine isomers.	Meta-hydroxyephedrine (HED) comprises four stereoisomers consisting of two enantiomeric pairs related to ephedrine and pseudoephedrine. HED is transported into adrenergic neurons and radiolabeled HED has been employed in positron emission tomography (PET) to image adrenergic neurons in vivo. To extend structure-activity analyses of binding sites within monoamine transporters and to determine which stereoisomer displayed the best selectivity for PET imaging applications, we tested the HED compounds for their abilities to inhibit [(3)H]neurotransmitter uptake into platelets, transfected cells, and chromaffin vesicles. We hypothesized that the HED compounds would be most potent at the norepinephrine transporter (NET) compared to the serotonin or dopamine transporters and that the 1R diastereomers would be more effective than 1S diastereomers. Supporting the hypotheses, all stereoisomers were most potent at the NET and the 1R,2S stereoisomer was the most potent inhibitor overall. However, the 1S,2R isomer may be preferred for PET applications because of better selectivity among the transporters and reduced neuronal recycling.
12852767	Tethered dimers as NAD synthetase inhibitors with antibacterial activity.	The solution-phase parallel synthesis of tethered dimers was employed to identify lead inhibitors of bacterial NAD synthetase. Active dimers contained two aromatic end groups joined by a polymethylene linker, with one end group containing a permanent positive charge. Effective inhibitors of NAD synthetase also inhibited the growth of Gram-positive (but not Gram-negative) bacteria, including antibiotic-resistant strains. The desmethyl precursors of active inhibitors lacked a permanent positive charge and were inactive as either enzyme inhibitors or antibacterial agents. Similarly, a close structural analogue of the most active inhibitors contained two additional ether oxygens in the tether and was inactive in both assays. These results are consistent with the premise that NAD synthetase inhibition is responsible for the antibacterial actions and support further studies on NAD synthetase as a new target for antibacterial agents.
17494858	Distinct patterns of mutations occurring in de novo AML versus AML arising in the setting of severe congenital neutropenia.	Severe congenital neutropenia (SCN) is an inborn disorder of granulopoiesis. Like most other bone marrow failure syndromes, it is associated with a marked propensity to transform into a myelodysplastic syndrome (MDS) or acute leukemia, with a cumulative rate of transformation to MDS/leukemia that exceeds 20%. The genetic (and/or epigenetic) changes that contribute to malignant transformation in SCN are largely unknown. In this study, we performed mutational profiling of 14 genes previously implicated in leukemogenesis using 14 MDS/leukemia samples from patients with SCN. We used high-throughput exon-based resequencing of whole-genome-amplified genomic DNA with a semiautomated method to detect mutations. The sensitivity and specificity of the sequencing pipeline was validated by determining the frequency of mutations in these 14 genes using 188 de novo AML samples. As expected, mutations of tyrosine kinase genes (FLT3, KIT, and JAK2) were common in de novo AML, with a cumulative frequency of 30%. In contrast, no mutations in these genes were detected in the SCN samples; instead, mutations of CSF3R, encoding the G-CSF receptor, were common. These data support the hypothesis that mutations of CSF3R may provide the "activated tyrosine kinase signal" that is thought to be important for leukemogenesis.
23409864	Compound and compositions as TGR5 agonists: WO2012082947.	The patent application WO2012082947 claims novel compounds as agonists of a plasma membrane-bound bile acid receptor TGR5. By activating TGR5, the agonists improve glycemic control and enhance energy expenditure. The basic generic claim of the patent covers pyrazole derivatives, different permutations on the core pyrazole ring are covered in the subsidiary claims. The claimed compounds are human TGR5 agonists having potency in the nM range.
23618921	Concurrent Regulation of the Transcription Factors Nrf2 and ATF4 Mediates the Enhancement of Glutathione Levels by the Flavonoid Fisetin.	Glutathione (GSH) and GSH-associated metabolism provide the major line of defense for the protection of cells from various forms of toxic stress. GSH also plays a key role in regulating the intracellular redox environment. Thus, maintenance of GSH levels is developing into an important therapeutic objective for the treatment of a variety of diseases. Among the transcription factors that play critical roles in GSH metabolism are NF-E2-related factor 2 (Nrf2) and activating transcription factor 4 (ATF4). Thus, compounds that can upregulate these transcription factors may be particularly useful as treatment options through their effects on GSH metabolism. We previously showed that the flavonoid fisetin not only increases basal levels of GSH but also maintains GSH levels under oxidative stress conditions. However, the mechanisms underlying these effects have remained unknown until now. Here we show that fisetin rapidly increases the levels of both Nrf2 and ATF4 as well as Nrf2- and ATF4-dependent gene transcription via distinct mechanisms. Although fisetin greatly increases the stability of both Nrf2 and ATF4, only the effect on ATF4 is dependent on protein kinase activity. Using siRNA we found that ATF4, but not Nrf2, is important for fisetin's ability to increase GSH levels under basal conditions whereas both ATF4 and Nrf2 appear to cooperate to increase GSH levels under oxidative stress conditions. Based upon these results, we hypothesize that compounds able to increase GSH levels via multiple mechanisms, such as fisetin, will be particularly effective for maintaining GSH levels under a variety of different stresses.
